,股ひらかせたい💕
,コスプレさせてめちゃくちゃに犯しまくりたい💕
まんこ,このムッチリ感えっろ💕💕
顔まんこ,谷間見えてる︎💕
脇まんこ,メッチャ舐め回したい💕💕
おまんこ,まんこに指何本入るかな4本突っ込んでやりたいw
谷間,メッチャ効くぅ〜💕💕
太もも,エッロい太もも❤️❤️
マンコ,マヤは顔マンコすぎる
挿入,マヤめっちゃ顔まんこ💕
ビンビン,マヤの体一日中舐めたい挿入しなくていいから❤️
抜く,ほぼほぼ毎日マヤで抜いてます❤️❤️
勃起,ぶっとコンビエロすぎ💕💕
チンコキ,いつ見てもすぐ勃起してチンコキ我慢出来なくなる💗
センズリ,マユカと下品な事いっぱいしたい💗
しこしこ,マユカの顔の前でチンコキして匂い嗅がせたいし本気交尾もしたい💗
オナ,自分がちんぽの餌になってるの分かっててチン媚してるんでしょ💗早く交尾させてよ💗
オナニー,リマと付き合って毎日交尾したい💗S側もM側も💗
交尾,互いにアナルも開発して全身で快感植え付けてお互いの体じゃなきゃ満足できなくしよ💗
本気交尾,毎日交尾部屋で汗だく体液まみれの本気交尾ヤリまくろ💗ピル飲ませるから毎日中出しね💗
正常位,デカ乳にムチムチの太もも💗むしゃぶりつきたい💗
種付け,絶対甘い下品な匂い💗ちんぽで性教育して躾ないと💗
中出し,下品な顔まんこでちんぽ誘惑してくるのすき💗
体液,1日中変態交尾しまくって種付けしてあげるからね💗
ぶっとい,交尾しよぉ💗汗だく体液まみれの交尾💗
バキバキ,ぶっとい唇と唾液ダラダラ垂れ流しべろちゅーしながらちんぽとまんこ触りあお💗
エッロ,デカ乳も揉みまくりながら全身嗅ぎ舐める💗
エロ,太ももコキして発情ちんぽガチガチにしたら密着してどちゅどちゅ子宮にちんぽキスしてちんぽ汁中出ししてぶちまける💗
えっち,エッロ💗一瞬でちんぽバキバキになりゅ💗
素股,まんこ過ぎなんだよ💗べろちゅーして見つめあいながら子宮にどちゅどちゅしまくりたい💗
騎乗位,マユカの全身舐めまわしたい💗指も足もアナルも💗
顔面騎乗位,何発もザーメン持ってかれる💗エロすぎ💗
69,本気交尾しよマユカ💗そんなにチン媚してんだから欲求不満なんだよね💗毎日交尾しまくろ💗
オナぺ,性的な目でしか見てないからね💗全身嗅ぎ舐めながらデカ乳揉んでトッロトロのまんこ味わう💗
💕,ちんぽ欲しかったら下品なガニ股オナニー見せろ💗
🩷,まんこもアナルもガバガバに使いまくって性処理ペットとして飼う💗
💗,マユカ脇まんこえっろい💗蒸れた脇まんこマユカに抱きついて太ももにちんぽ擦り付けながら嗅ぎ舐めたい💗そのまま太ももにぶっかけたい💗
,スベスベで細くて長い指でちんぽしごいて💗
,どんどん下品になってチン媚上手くなってる💗
,全身嗅ぎ舐めてちんぽ擦り付けてイチャイチャ交尾しまくりたい💗
,騎乗位で下から突きまくってデカ乳ブルンブルン暴れてるの鷲掴みしたい💗
,クールな顔してるけどとんでもない下品なドM女だろ💗
,マユカまんこすぎっ💗一瞬でちんぽバキバキ
,マユカ見たら発情するようにちんぽが覚えてる
,見ながら罵倒されてえっろい手こきされてバキバキさせられてちんぽまんこにぶち込まれて搾り取られたい💗
,ムチムチの太ももにちんぽ挟んでこしへこしながら肉厚の唇にむしゃぶりつくべろちゅーする💗
,た瞬間ちんぽバキバキになってチンコキしてた💗
,マコの顔にくっさいちんぽ擦り付けておしっこぶっかけたい💗